{
  "schemaVersion": 1,
  "id": "public.spaceship-titanic.v1",
  "kind": "public",
  "slug": "spaceship-titanic",
  "version": 1,
  "status": "pending",
  "task": {
    "type": "classification",
    "targetColumn": "transported",
    "primaryMetric": "accuracy"
  },
  "storage": {
    "root": "testing/benchmarks/data/public/spaceship-titanic/v1",
    "canonicalFile": "canonical/data.csv"
  },
  "integrity": {
    "canonicalSha256": null
  },
  "provenance": {
    "upstreamUrl": "https://www.kaggle.com/competitions/spaceship-titanic",
    "acquisition": "manual-stage",
    "license": "See upstream terms"
  },
  "suiteRefs": ["expo-public-p0.v1"]
}
