{
  "schemaVersion": 1,
  "id": "public.adult-income.v1",
  "kind": "public",
  "slug": "adult-income",
  "version": 1,
  "status": "pending",
  "task": {
    "type": "classification",
    "targetColumn": "income",
    "primaryMetric": "accuracy"
  },
  "storage": {
    "root": "testing/benchmarks/data/public/adult-income/v1",
    "canonicalFile": "canonical/data.csv"
  },
  "integrity": {
    "canonicalSha256": null
  },
  "provenance": {
    "upstreamUrl": "https://uci-ics-mlr-prod.aws.uci.edu/dataset/2/adult",
    "acquisition": "scripted-open",
    "license": "See upstream terms"
  },
  "suiteRefs": ["expo-public-p0.v1"]
}
